{
  "job_id": "job_commit_push_20260302_001",
  "type": "commit_push",
  "params": {
    "remote": "origin",
    "branch": "main",
    "message": "[AUTO] Bridge commit",
    "add_paths": [
      "analysis/plots/catchment_custom",
      "analysis/results/catchment_custom"
    ]
  },
  "created_at": "2026-03-02T17:05:00Z"
}
